Symbol,Name,Last Sale,Net Change,% Change,Market Cap,Country,IPO Year,Volume,Sector,Industry
QRHC,Quest Resource Holding Corporation Common Stock,$2.77,-0.03,-1.071%,57079714.00,United States,,66501,Utilities,Environmental Services
QRVO,Qorvo Inc. Common Stock,$73.69,-1.31,-1.747%,6882412550.00,United States,,1353509,Technology,Semiconductors
QS,QuantumScape Corporation Class A Common Stock,$4.52,-0.05,-1.094%,2472028300.00,United States,2020,8182502,Miscellaneous,Industrial Machinery/Components
QSEAU,Quartzsea Acquisition Corporation Units,$10.10,0.00,0.00%,0.00,United States,2025,104131,Finance,Blank Checks
QSG,QuantaSing Group Limited American Depositary Shares,$3.06,0.06,2.00%,156405789.00,China,2023,522178,Real Estate,Other Consumer Services
QSI,Quantum-Si Incorporated Class A Common Stock,$1.31,-0.08,-5.755%,239912883.00,United States,2020,3924178,Industrials,Industrial Machinery/Components
QSIAW,Quantum-Si Incorporated Warrant,$0.4231,-0.0259,-5.768%,77486367.00,United States,2020,23415,Industrials,Industrial Machinery/Components
QSR,Restaurant Brands International Inc. Common Shares,$68.74,0.90,1.327%,31072076280.00,Canada,2014,1486350,Consumer Discretionary,Restaurants
QTRX,Quanterix Corporation Common Stock,$6.77,0.11,1.652%,262514928.00,United States,2017,599441,Industrials,Biotechnology: Laboratory Analytical Instruments
QTTB,Q32 Bio Inc. Common Stock,$1.89,-0.10,-5.025%,23053492.00,United States,2018,163347,Health Care,Biotechnology: Pharmaceutical Preparations
QTWO,Q2 Holdings Inc. Common Stock,$82.72,0.20,0.242%,5023419002.00,United States,2014,846962,Technology,Computer Software: Prepackaged Software
QUAD,Quad Graphics Inc Class A Common Stock,$5.48,-0.07,-1.261%,286865369.00,United States,,156571,Consumer Discretionary,Publishing
QUBT,Quantum Computing Inc. Common Stock,$7.94,-0.07,-0.874%,1089721687.00,United States,,10672426,Technology,Computer Software: Prepackaged Software
QUIK,QuickLogic Corporation Common Stock,$5.71,-0.03,-0.523%,90212496.00,United States,1999,117165,Technology,Semiconductors
QURE,uniQure N.V. Ordinary Shares,$13.125,-0.525,-3.846%,709759050.00,Netherlands,2014,2009182,Health Care,Biotechnology: Pharmaceutical Preparations
QVCC,QVC Inc. 6.250% Senior Secured Notes due 2068,$10.04,-0.02,-0.199%,0.00,United States,2019,113638,Consumer Discretionary,Catalog/Specialty Distribution
QVCD,QVC Inc. 6.375% Senior Secured Notes due 2067,$10.16,-0.09,-0.878%,0.00,United States,2018,24748,Consumer Discretionary,Catalog/Specialty Distribution
QVCGA,QVC Group Inc. Series A Common Stock,$0.2102,0.0001,0.048%,83782010.00,United States,,1759683,Consumer Discretionary,Catalog/Specialty Distribution
QVCGB,QVC Group Inc. Series B Common Stock,$7.15,0.17,2.436%,2849863788.00,United States,,5442,Consumer Discretionary,Catalog/Specialty Distribution
QVCGP,QVC Group Inc. 8.0% Fixed Rate Cumulative Redeemable Preferred Stock,$29.16,0.30,1.04%,11622661268.00,United States,,48548,Consumer Discretionary,Catalog/Specialty Distribution
QXO,QXO Inc. Common Stock,$14.01,0.45,3.319%,5736117032.00,United States,,1568873,Technology,EDP Services
R,Ryder System Inc. Common Stock,$143.97,-0.63,-0.436%,6058967084.00,United States,,252108,Consumer Discretionary,Rental/Leasing Companies
RA,Brookfield Real Assets Income Fund Inc. Common Stock,$13.18,-0.02,-0.152%,0.00,United States,2016,268745,Finance,Investment Managers
RACE,Ferrari N.V. Common Shares,$426.82,13.09,3.164%,103451438211.00,Italy,2015,1514231,Consumer Discretionary,Auto Manufacturing
RADX,Radiopharm Theranostics Limited American Depositary Shares,$5.70,0.18,3.261%,12385876309.00,Australia,,9727,,
RAIL,FreightCar America Inc. Common Stock,$5.96,-0.20,-3.247%,113599966.00,United States,2005,211574,Industrials,Railroads
RAIN,Rain Enhancement Technologies Holdco Inc. Class A Common Stock,$1.988,-0.042,-2.069%,13173206.00,United States,,1720,Technology,Industrial Machinery/Components
RAINW,Rain Enhancement Technologies Holdco Inc. Warrants,$0.093,-0.0161,-14.757%,616252.00,United States,,4327,Technology,Industrial Machinery/Components
RAMP,LiveRamp Holdings Inc. Common Stock,$27.02,-0.40,-1.459%,1776853844.00,United States,2018,363469,Technology,EDP Services
RAND,Rand Capital Corporation Common Stock,$19.59,0.59,3.105%,58178656.00,United States,,2396,Finance,Finance: Consumer Services
RANG,Range Capital Acquisition Corp. Ordinary Shares,$10.03,0.01,0.10%,0.00,United States,2025,1600,,
RANGR,Range Capital Acquisition Corp. Rights,$0.186,-0.004,-2.105%,0.00,United States,2025,190,,
RANGU,Range Capital Acquisition Corp. Units,$10.2199,0.0299,0.293%,0.00,United States,2024,1790,,
RANI,Rani Therapeutics Holdings Inc. Class A Common Stock,$1.34,-0.09,-6.294%,76766834.00,United States,2021,425080,Health Care,Biotechnology: Pharmaceutical Preparations
RAPP,Rapport Therapeutics Inc. Common Stock,$9.70,0.00,0.00%,354015439.00,United States,2024,199575,Health Care,Biotechnology: Pharmaceutical Preparations
RAPT,RAPT Therapeutics Inc. Common Stock,$1.415,-0.035,-2.414%,186789662.00,United States,2019,507740,Health Care,Biotechnology: Pharmaceutical Preparations
RARE,Ultragenyx Pharmaceutical Inc. Common Stock,$38.89,0.91,2.396%,3597368790.00,United States,2014,558142,Health Care,Biotechnology: Pharmaceutical Preparations
RAVE,Rave Restaurant Group Inc. Common Stock,$2.78,0.03,1.091%,40898153.00,United States,,9916,Consumer Discretionary,Food Distributors
RAY,Raytech Holding Limited Ordinary Shares,$1.92,-0.02,-1.031%,33817119.00,Hong Kong,2024,794948,Consumer Discretionary,Consumer Electronics/Appliances
RAYA,Erayak Power Solution Group Inc. Class A Ordinary Shares,$1.21,0.00,0.00%,15064500.00,China,2022,7472,Consumer Discretionary,Metal Fabrications
RBA,RB Global Inc. Common Stock,$100.29,-0.01,-0.01%,18478834161.00,Canada,,1012554,Consumer Discretionary,Business Services
RBB,RBB Bancorp Common Stock,$16.99,0.00,0.00%,301234756.00,United States,2017,27239,Finance,Major Banks
RBBN,Ribbon Communications Inc. Common Stock,$4.01,-0.06,-1.474%,704653577.00,United States,,342637,Technology,EDP Services
RBC,RBC Bearings Incorporated Common Stock,$332.76,0.40,0.12%,10463386966.00,United States,2022,164032,Industrials,Metal Fabrications
RBCAA,Republic Bancorp Inc. Class A Common Stock,$66.15,1.05,1.613%,1289298096.00,United States,1998,23320,Finance,Major Banks
RBKB,Rhinebeck Bancorp Inc. Common Stock,$9.8991,-0.3809,-3.705%,109828812.00,United States,2019,47886,Finance,Banks
RBLX,Roblox Corporation Class A Common Stock,$59.50,-0.86,-1.425%,39704349108.00,United States,2021,3415887,Technology,Computer Software: Prepackaged Software
RBOT,Vicarious Surgical Inc. Class A Common Stock,$6.59,-0.52,-7.314%,39082667.00,Hong Kong,2020,19504,Health Care,Industrial Specialties
RBRK,Rubrik Inc. Class A Common Stock,$66.00,-2.61,-3.804%,12525389382.00,United States,2024,2532042,Technology,Computer Software: Prepackaged Software
RC,Ready Capital Corporation Common Stock,$5.05,0.08,1.61%,823912984.00,United States,2013,3068828,Real Estate,Real Estate Investment Trusts
RC^C,Ready Capital Corporation 6.25% Series C Cumulative Convertible Preferred Stock,$16.4624,0.4424,2.762%,,United States,,611,,
RC^E,Ready Capital Corporation 6.50% Series E Cumulative Redeemable Preferred Stock,$16.5899,0.0706,0.427%,,United States,,16570,,
RCAT,Red Cat Holdings Inc. Common Stock,$6.00,0.185,3.181%,480964692.00,United States,,2986306,Technology,Computer Software: Prepackaged Software
RCB,Ready Capital Corporation 6.20% Senior Notes due 2026,$24.01,-0.03,-0.125%,3917257575.00,United States,2019,2702,Real Estate,Real Estate Investment Trusts
RCC,Ready Capital Corporation 5.75% Senior Notes due 2026,$24.64,0.1066,0.435%,4020042759.00,United States,2021,2889,Real Estate,Real Estate Investment Trusts
RCD,Ready Capital Corporation 9.00% Senior Notes due 2029,$23.685,0.145,0.616%,0.00,United States,2024,11456,Real Estate,Real Estate Investment Trusts
RCEL,Avita Medical Inc. Common Stock,$9.22,0.22,2.444%,243016537.00,United States,,108609,Health Care,Medical/Dental Instruments
RCG,RENN Fund Inc Common Stock,$2.52,-0.055,-2.136%,0.00,United States,,3094,Finance,Investment Managers
RCI,Rogers Communication Inc. Common Stock,$27.76,0.07,0.253%,14836821825.00,Canada,,1124316,Telecommunications,Cable & Other Pay Television Services
RCKT,Rocket Pharmaceuticals Inc. Common Stock,$7.88,0.19,2.471%,840242044.00,United States,2015,1934063,Health Care,Biotechnology: Pharmaceutical Preparations
RCKTW,Rocket Pharmaceuticals Inc. Warrant,$0.0468,-0.0022,-4.49%,4990270.00,United States,,1100,Health Care,Biotechnology: Pharmaceutical Preparations
RCKY,Rocky Brands Inc. Common Stock,$17.84,-0.10,-0.557%,133130144.00,United States,1993,34099,Consumer Discretionary,Shoe Manufacturing
RCL,Royal Caribbean Cruises Ltd. Common Stock,$217.24,-2.62,-1.192%,58465530519.00,United States,1993,1684905,Consumer Discretionary,Marine Transportation
RCMT,RCM Technologies Inc. Common Stock,$15.66,-0.11,-0.698%,118837116.00,United States,,21975,Consumer Discretionary,Professional Services
RCON,Recon Technology Ltd. Class A Ordinary Shares,$1.55,0.03,1.974%,23386336.00,China,2009,19996,Energy,Oilfield Services/Equipment
RCS,PIMCO Strategic Income Fund Inc.,$6.18,-0.03,-0.483%,0.00,United States,1994,102463,Finance,Investment Managers
RCT,RedCloud Holdings plc Ordinary Shares,$3.90,0.20,5.405%,254929385.00,United Kingdom,2025,97105,Consumer Discretionary,Other Specialty Stores
RCUS,Arcus Biosciences Inc. Common Stock,$8.49,0.23,2.785%,898593673.00,United States,2018,619726,Health Care,Biotechnology: Pharmaceutical Preparations
RDAC,Rising Dragon Acquisition Corp. Ordinary Shares,$10.20,0.00,0.00%,0.00,China,2024,1003,,
RDCM,Radcom Ltd. Ordinary Shares,$12.16,-0.03,-0.246%,194916470.00,Israel,1997,15914,Technology,Computer peripheral equipment
RDDT,Reddit Inc. Class A Common Stock,$110.23,-9.97,-8.295%,19941086390.00,United States,2024,6775399,Technology,EDP Services
RDFN,Redfin Corporation Common Stock,$10.22,-0.15,-1.446%,1291698544.00,United States,2017,5050551,Finance,Real Estate
RDGT,Ridgetech Inc. Ordinary Shares,$1.18,-0.0324,-2.672%,7851811.00,China,,109018,Consumer Staples,Retail-Drug Stores and Proprietary Stores
RDHL,Redhill Biopharma Ltd. American Depositary Shares,$2.75,0.00,0.00%,3521482.00,Israel,,5310,Health Care,Biotechnology: Pharmaceutical Preparations
RDI,Reading International Inc Class A Common Stock,$1.34,-0.01,-0.741%,30051087.00,United States,,3383,Consumer Discretionary,Movies/Entertainment
RDIB,Reading International Inc Class B Common Stock,$7.00,0.00,0.00%,156983288.00,United States,,411,Consumer Discretionary,Movies/Entertainment
RDN,Radian Group Inc. Common Stock,$33.45,0.28,0.844%,4852362200.00,United States,,1068963,Finance,Property-Casualty Insurers
RDNT,RadNet Inc. Common Stock,$50.67,-0.05,-0.099%,3751693699.00,United States,,823399,Health Care,Medical Specialities
RDUS,Radius Recycling Inc. Class A Common Stock,$29.08,-0.02,-0.069%,818758567.00,United States,,747741,Consumer Discretionary,Industrial Specialties
RDVT,Red Violet Inc. Common Stock ,$38.20,-1.21,-3.07%,532455399.00,United States,,54978,Technology,Computer Software: Prepackaged Software
RDW,Redwire Corporation Common Stock,$9.86,-1.19,-10.769%,745152679.00,United States,2021,1594136,Industrials,Military/Government/Technical
RDWR,Radware Ltd. Ordinary Shares,$22.53,-0.30,-1.314%,939475676.00,Israel,1999,49363,Consumer Discretionary,Business Services
RDY,Dr. Reddy's Laboratories Ltd Common Stock,$13.27,-0.02,-0.15%,11072298637.00,India,,3053430,Health Care,Biotechnology: Pharmaceutical Preparations
RDZN,Roadzen Inc. Ordinary Shares,$1.05,0.05,5.00%,77900535.00,United States,2022,151740,Finance,Specialty Insurers
REAL,The RealReal Inc. Common Stock,$5.81,-0.28,-4.598%,646342792.00,United States,2019,2113944,Consumer Discretionary,Other Specialty Stores
REAX,The Real Brokerage Inc. Common Shares,$4.26,-0.06,-1.389%,842363880.00,Canada,,445386,Finance,Real Estate
REBN,Reborn Coffee Inc. Common Stock,$4.01,0.01,0.25%,14726982.00,United States,2022,78045,Consumer Discretionary,Restaurants
RECT,Rectitude Holdings Ltd Ordinary Shares,$4.00,0.02,0.503%,58000000.00,Singapore,2024,4462,Consumer Discretionary,Industrial Machinery/Components
REE,REE Automotive Ltd. Class A Ordinary Shares,$3.37,-0.28,-7.671%,37854637.00,Israel,,577809,Consumer Discretionary,Auto Manufacturing
REFI,Chicago Atlantic Real Estate Finance Inc. Common Stock,$15.41,0.04,0.26%,321973227.00,United States,2021,118032,Real Estate,Real Estate Investment Trusts
REFR,Research Frontiers Incorporated Common Stock,$1.19,0.00,0.00%,40041383.00,United States,,26523,Miscellaneous,Multi-Sector Companies
REG,Regency Centers Corporation Common Stock,$72.39,-0.44,-0.604%,13129029506.00,United States,1993,598210,Real Estate,Real Estate Investment Trusts
REGCO,Regency Centers Corporation 5.875% Series B Cumulative Redeemable Preferred Stock,$22.24,0.54,2.488%,4033562871.00,United States,,44335,Real Estate,Real Estate Investment Trusts
REGCP,Regency Centers Corporation 6.25% Series A Cumulative Redeemable Preferred Stock,$23.4115,0.0115,0.049%,4246032246.00,United States,,2057,Real Estate,Real Estate Investment Trusts
REGN,Regeneron Pharmaceuticals Inc. Common Stock,$635.83,-4.31,-0.673%,69511912556.00,United States,1991,811470,Health Care,Biotechnology: Pharmaceutical Preparations
REI,Ring Energy Inc. Common Stock,$1.20,-0.02,-1.639%,239946635.00,United States,,756636,Energy,Oil & Gas Production
REKR,Rekor Systems Inc. Common Stock,$1.01,0.00,0.00%,94763577.00,United States,,2031508,Telecommunications,Telecommunications Equipment
RELI,Reliance Global Group Inc. Common Stock,$1.265,-0.015,-1.172%,3630384.00,United States,,17230,Finance,Specialty Insurers
RELL,Richardson Electronics Ltd. Common Stock,$11.48,-0.27,-2.298%,165410820.00,United States,1983,41428,Technology,Electronic Components
RELX,RELX PLC PLC American Depositary Shares (Each representing One Ordinary Share),$50.07,0.10,0.20%,93056211411.00,United Kingdom,2015,526039,Consumer Discretionary,Business Services
RELY,Remitly Global Inc. Common Stock,$21.19,-0.13,-0.61%,4250870382.00,United States,2021,1150383,Consumer Discretionary,Business Services
RENB,Renovaro Inc. Common Stock,$0.6495,-0.0246,-3.649%,103087022.00,United States,,581008,Health Care,Biotechnology: Pharmaceutical Preparations
RENE,Cartesian Growth Corporation II Class A Ordinary Shares,$11.83,0.00,0.00%,0.00,United States,2022,52,Finance,Blank Checks
RENEW,Cartesian Growth Corporation II Warrant,$0.0704,0.0154,28.00%,0.00,United States,2022,1525,Finance,Blank Checks
RENT,Rent the Runway Inc. Class A Common Stock,$4.90,-0.27,-5.222%,19022854.00,United States,2021,84497,Consumer Discretionary,Other Specialty Stores
REPL,Replimune Group Inc. Common Stock,$10.45,0.05,0.481%,804804461.00,United States,2018,312321,Health Care,Biotechnology: Biological Products (No Diagnostic Substances)
REPX,Riley Exploration Permian Inc. Common Stock,$29.66,-0.34,-1.133%,637848325.00,United States,1999,100214,Energy,Oil & Gas Production
RERE,ATRenew Inc. American Depositary Shares (every three of which representing two Class A ordinary shares),$3.12,-0.03,-0.952%,691704000.00,Cayman Islands,2021,438653,Consumer Discretionary,Other Specialty Stores
RES,RPC Inc. Common Stock,$5.62,0.06,1.079%,1214215792.00,United States,,1071011,Energy,Oilfield Services/Equipment
RETO,ReTo Eco-Solutions Inc. Class A Shares,$3.48,0.07,2.053%,6734719.00,China,2017,19036,Industrials,Industrial Machinery/Components
REVB,Revelation Biosciences Inc. Common Stock,$2.76,-0.07,-2.473%,2498429.00,United States,2020,13116,Health Care,Biotechnology: Pharmaceutical Preparations
REVBW,Revelation Biosciences Inc. Warrant,$0.0119,-0.0002,-1.653%,10772.00,United States,2020,6966,Health Care,Biotechnology: Pharmaceutical Preparations
REVG,REV Group Inc. Common Stock,$33.33,-0.34,-1.01%,1722333249.00,United States,2017,574726,Consumer Discretionary,Auto Manufacturing
REX,REX American Resources Corporation,$39.42,0.81,2.098%,692497132.00,United States,,145219,Industrials,Major Chemicals
REXR,Rexford Industrial Realty Inc. Common Stock,$39.92,0.02,0.05%,9100333778.00,United States,2013,1584165,Real Estate,Real Estate Investment Trusts
REXR^B,Rexford Industrial Realty Inc. 5.875% Series B Cumulative Redeemable Preferred Stock,$22.92,-0.23,-0.994%,,United States,,4021,,
REXR^C,Rexford Industrial Realty Inc. 5.625% Series C Cumulative Redeemable Preferred Stock par value $0.01 per share,$21.78,0.165,0.763%,,United States,,4086,,
REYN,Reynolds Consumer Products Inc. Common Stock,$23.82,0.43,1.838%,5006277341.00,United States,2020,425622,Consumer Discretionary,Containers/Packaging
REZI,Resideo Technologies Inc. Common Stock ,$18.51,0.10,0.543%,2737224482.00,United States,2018,949555,Industrials,Wholesale Distributors
RF,Regions Financial Corporation Common Stock,$21.93,-0.31,-1.394%,19856849007.00,United States,,5411496,Finance,Major Banks
RF^C,Regions Financial Corporation Depositary Shares each Representing a 1/40th Interest in a  Share of 5.700% Fixed-to-Floating Rate Non-Cumulative  Perpetual Preferred Stock Series C,$24.34,-0.10,-0.409%,,United States,,27685,,
RF^E,Regions Financial Corporation Depositary Shares Each Representing a 1/40th Interest in a Share of 4.45% Non-Cumulative Perpetual Preferred Stock Series E,$17.69,-0.08,-0.45%,,United States,,22573,,
RF^F,Regions Financial Corporation Depositary Shares Each Representing a 1/40th Interest in a Share of Non-Cumulative Perpetual Preferred Stock Series F,$25.32,-0.06,-0.236%,,United States,,36493,,
RFAI,RF Acquisition Corp II Ordinary Shares,$10.37,0.00,0.00%,0.00,Singapore,2024,5,,
RFAIR,RF Acquisition Corp II Right,$0.08,0.00,0.00%,0.00,Singapore,2024,25,Technology,Computer Software: Prepackaged Software
RFI,Cohen & Steers Total Return Realty Fund Inc. Common Stock,$11.86,0.00,0.00%,582784128.00,United States,1993,28843,Finance,Investment Managers
RFIL,RF Industries Ltd. Common Stock,$4.89,0.30,6.536%,52175699.00,United States,,21537,Technology,Electrical Products
RFL,Rafael Holdings Inc. Class B Common Stock,$1.97,-0.01,-0.505%,49078161.00,United States,2018,38175,Finance,Real Estate
RFM,RiverNorth Flexible Municipal Income Fund Inc. Common Stock,$14.78,-0.09,-0.605%,90375251.00,,2020,9408,Finance,Finance/Investors Services
RFMZ,RiverNorth Flexible Municipal Income Fund II Inc. Common Stock,$13.41,-0.04,-0.297%,326557048.00,,2021,57126,Finance,Trusts Except Educational Religious and Charitable
RGA,Reinsurance Group of America Incorporated Common Stock,$201.29,-0.32,-0.159%,13290060333.00,United States,,285816,Finance,Life Insurance
RGC,Regencell Bioscience Holdings Limited Ordinary Shares,$34.87,-3.93,-10.129%,453758637.00,Hong Kong,2021,91327,Health Care, Medicinal Chemicals and Botanical Products 
RGCO,RGC Resources Inc. Common Stock,$21.00,0.20,0.962%,216236265.00,United States,,10148,Utilities,Oil & Gas Production
RGEN,Repligen Corporation Common Stock,$137.12,-2.31,-1.657%,7699089999.00,United States,1986,313522,Health Care,Biotechnology: Biological Products (No Diagnostic Substances)
RGLD,Royal Gold Inc. Common Stock,$161.30,1.96,1.23%,10606864761.00,United States,,524537,Industrials,Precious Metals
RGLS,Regulus Therapeutics Inc. Common Stock,$1.50,0.21,16.279%,99365076.00,United States,2012,32532622,Health Care,Biotechnology: Pharmaceutical Preparations
RGNX,REGENXBIO Inc. Common Stock,$7.91,-0.29,-3.537%,396181352.00,United States,2015,513608,Health Care,Biotechnology: Biological Products (No Diagnostic Substances)
RGP,Resources Connection Inc. Common Stock,$6.75,0.09,1.351%,223364972.00,United States,,140844,Consumer Discretionary,Business Services
RGR,Sturm Ruger & Company Inc. Common Stock,$39.93,0.38,0.961%,669310653.00,United States,,138282,Industrials,Ordnance And Accessories
RGS,Regis Corporation Common Stock,$18.87,0.19,1.017%,45966924.00,United States,1991,9051,Consumer Discretionary,Other Consumer Services
RGT,Royce Global Trust Inc. Common Stock,$10.69,0.01,0.094%,66993621.00,,2013,10095,Finance,Trusts Except Educational Religious and Charitable
RGTI,Rigetti Computing Inc. Common Stock,$8.47,-0.71,-7.734%,2420963558.00,United States,,28869360,Technology,EDP Services
RGTIW,Rigetti Computing Inc. Warrants,$2.93,-0.29,-9.006%,837476178.00,United States,,119385,Technology,EDP Services
RH,RH Common Stock,$243.42,-0.16,-0.066%,4528305260.00,United States,2012,953666,Consumer Discretionary,Other Specialty Stores
RHI,Robert Half Inc. Common Stock,$55.04,1.11,2.058%,5625058774.00,United States,,1122579,Consumer Discretionary,Professional Services
RHLD,Resolute Holdings Management Common Stock ,$32.35,-0.77,-2.325%,274535525.00,United States,,76458,Finance,Finance: Consumer Services
RHP,Ryman Hospitality Properties Inc. (REIT),$93.45,-0.78,-0.828%,5597972823.00,United States,,864731,Real Estate,Real Estate Investment Trusts
RIBB,Ribbon Acquisition Corp Class A Ordinary Shares,$9.98,0.00,0.00%,0.00,Japan,2025,52582,,
RICK,RCI Hospitality Holdings Inc. Common Stock,$46.54,0.825,1.805%,412664363.00,United States,1995,39011,Consumer Discretionary,Restaurants
RIG,Transocean Ltd (Switzerland) Common Stock,$3.30,0.08,2.484%,2889005836.00,Switzerland,,33526989,Energy,Oil & Gas Production
RIGL,Rigel Pharmaceuticals Inc. Common Stock,$18.39,-0.59,-3.109%,328499798.00,United States,2000,187416,Health Care,Biotechnology: Pharmaceutical Preparations
RILY,B. Riley Financial Inc. Common Stock,$4.13,-0.09,-2.133%,125952883.00,United States,,840345,Finance,Investment Managers
RILYG,B. Riley Financial Inc. 5.00% Senior Notes due 2026,$12.94,-0.28,-2.118%,394632034.00,United States,,18996,Finance,Investment Managers
RILYK,B. Riley Financial Inc. 5.50% Senior Notes Due 2026,$21.89,0.29,1.343%,667580775.00,United States,,27042,Finance,Investment Managers
RILYL,B. Riley Financial Inc. Depositary Shares each representing 1/1000th in a share of 7.375% Series B Cumulative Perpetual Preferred Stock par value $0.0001,$3.88,-0.09,-2.267%,118328616.00,United States,,10567,Finance,Investment Managers
RILYN,B. Riley Financial Inc. 6.50% Senior Notes Due 2026,$13.30,-0.71,-5.068%,405610978.00,United States,,60697,Finance,Investment Managers
RILYP,B. Riley Financial Inc. Depositary Shares each representing a 1/1000th fractional interest in a share of Series A Cumulative Perpetual Preferred Stock,$3.84,-0.1736,-4.325%,117108733.00,United States,,6452,Finance,Investment Managers
RILYT,B. Riley Financial Inc. 6.00% Senior Notes Due 2028,$9.68,-0.24,-2.419%,295211599.00,United States,,23905,Finance,Investment Managers
RILYZ,B. Riley Financial Inc. 5.25% Senior Notes due 2028,$9.46,-0.17,-1.765%,288502244.00,United States,,81219,Finance,Investment Managers
RIME,Algorhythm Holdings Inc. Common Stock,$2.29,0.01,0.439%,5454320.00,United States,,78419,Consumer Staples,Diversified Electronic Products
RIO,Rio Tinto Plc Common Stock,$62.34,-0.53,-0.843%,78115242292.00,Australia,2002,1888459,Basic Materials,Metal Mining
RIOT,Riot Platforms Inc. Common Stock ,$7.77,-0.13,-1.646%,2721112555.00,United States,,21901985,Finance,Finance: Consumer Services
RITM,Rithm Capital Corp. Common Stock,$11.63,-0.03,-0.257%,6055276765.00,United States,,2836675,Real Estate,Real Estate Investment Trusts
RITM^A,Rithm Capital Corp. 7.50% Series A Fixed-to-Floating Rate Cumulative Redeemable Preferred Stock,$25.48,-0.02,-0.078%,,United States,,28244,,
RITM^B,Rithm Capital Corp. 7.125% Series B Fixed-to-Floating Rate Cumulative Redeemable Preferred Stock,$25.46,0.01,0.039%,,United States,,22582,,
RITM^C,Rithm Capital Corp. 6.375% Series C Fixed-to-Floating Rate Cumulative Redeemable Preferred Stock,$25.08,0.05,0.20%,,United States,,36070,,
RITM^D,Rithm Capital Corp. 7.00% Fixed-Rate Reset Series D Cumulative Redeemable Preferred Stock,$24.47,-0.13,-0.528%,,United States,,21371,,
RITR,Reitar Logtech Holdings Limited Ordinary shares,$2.69,0.07,2.672%,220916250.00,Hong Kong,2024,33297,Finance,Real Estate
RIV,RiverNorth Opportunities Fund Inc. Common Stock,$11.82,0.02,0.169%,0.00,United States,2015,42712,Finance,Finance Companies
RIV^A,RiverNorth Opportunities Fund Inc. 6.00% Series A Perpetual Preferred Stock,$23.6709,0.0159,0.067%,,United States,,3857,,
RIVN,Rivian Automotive Inc. Class A Common Stock,$13.02,0.92,7.603%,14721902334.00,United States,2021,62257133,Consumer Discretionary,Auto Manufacturing
RJF,Raymond James Financial Inc. Common Stock,$142.64,-1.90,-1.315%,29228367250.00,United States,,1054150,Finance,Investment Bankers/Brokers/Service
RJF^B,Raymond James Financial Inc. Depositary Shares each representing a 1/40th interest in a share of 6.375% Fixed-to-Floating Rate Series B Non-Cumulative Perpetual Preferred Stock,$25.225,-0.0549,-0.217%,,United States,,3489,,
RKDA,Arcadia Biosciences Inc. Common Stock,$3.3938,0.0883,2.671%,4639460.00,United States,2015,958,Consumer Staples,Farming/Seeds/Milling
RKLB,Rocket Lab USA Inc. Common Stock,$18.42,-1.02,-5.247%,8354300650.00,United States,2020,11754337,Industrials,Military/Government/Technical
RKT,Rocket Companies Inc. Class A Common Stock,$13.16,-0.06,-0.454%,26269811998.00,United States,2020,5465406,Finance,Finance: Consumer Services
RL,Ralph Lauren Corporation Common Stock,$225.16,-3.61,-1.578%,13906830649.00,United States,1997,812607,Consumer Discretionary,Apparel
RLAY,Relay Therapeutics Inc. Common Stock,$2.99,0.13,4.545%,506870329.00,United States,2020,2044844,Health Care,Biotechnology: Biological Products (No Diagnostic Substances)
RLGT,Radiant Logistics Inc. Common Stock,$6.32,0.15,2.431%,297093865.00,United States,,335690,Consumer Discretionary,Oil Refining/Marketing
RLI,RLI Corp. Common Stock (DE),$79.28,0.97,1.239%,7275060385.00,United States,,228632,Finance,Property-Casualty Insurers
RLJ,RLJ Lodging Trust Common Shares of Beneficial Interest $0.01 par value,$8.19,-0.14,-1.681%,1244566552.00,United States,2011,2618269,Real Estate,Real Estate Investment Trusts
