Symbol,Name,Last Sale,Net Change,% Change,Market Cap,Country,IPO Year,Volume,Sector,Industry
ITUB,Itau Unibanco Banco Holding SA American Depositary Shares (Each repstg 500 Preferred shares),$5.60,-0.02,-0.356%,60393467702.00,Brazil,,18498180,Finance,Major Banks
ITW,Illinois Tool Works Inc. Common Stock,$251.96,-3.93,-1.536%,73950260000.00,United States,,1491812,Industrials,Industrial Machinery/Components
IVA,Inventiva S.A. American Depository Shares,$3.0434,0.1684,5.857%,158609247.00,France,2020,5991,Health Care,Biotechnology: Pharmaceutical Preparations
IVAC,Intevac Inc. Common Stock,$4.00,0.01,0.251%,108672324.00,United States,1995,348318,Technology,Industrial Machinery/Components
IVCA,Investcorp AI Acquisition Corp. Class A Ordinary Share,$12.04,0.00,0.00%,0.00,Cayman Islands,2022,2105,Finance,Blank Checks
IVCAW,Investcorp AI Acquisition Corp. Warrant,$0.0176,-0.001,-5.376%,0.00,Cayman Islands,2022,100,Finance,Blank Checks
IVDA,Iveda Solutions Inc. Common Stock,$2.40,-0.09,-3.614%,6379370.00,United States,,13711,Technology,Computer Software: Prepackaged Software
IVDAW,Iveda Solutions Inc. Warrant,$0.1699,-0.0001,-0.059%,451606.00,United States,,110,Technology,Computer Software: Prepackaged Software
IVP,Inspire Veterinary Partners Inc. Class A Common Stock,$1.71,0.00,0.00%,2530673.00,United States,2023,21506,Consumer Staples,Farming/Seeds/Milling
IVR,INVESCO MORTGAGE CAPITAL INC Common Stock,$8.17,0.04,0.492%,504331592.00,United States,2009,2835786,Real Estate,Real Estate Investment Trusts
IVR^C,INVESCO MORTGAGE CAPITAL INC 7.5% Fixed-to-Floating Series C Cumulative Redeemable Preferred Stock Liquation Preference $25.00 per Share,$24.43,0.15,0.618%,,United States,,11363,,
IVT,InvenTrust Properties Corp. Common Stock,$29.27,-0.13,-0.442%,2267262279.00,United States,2021,423090,Real Estate,Real Estate Investment Trusts
IVVD,Invivyd Inc. Common Stock,$0.61,-0.0055,-0.894%,73176481.00,United States,2021,1653219,Health Care,Biotechnology: Biological Products (No Diagnostic Substances)
IVZ,Invesco Ltd Common Stock,$15.55,-0.14,-0.892%,6960207974.00,United States,,3667829,Finance,Investment Managers
IX,ORIX Corporation American Depositary Shares,$21.67,0.17,0.791%,24620758176.00,Japan,,186775,Finance,Diversified Financial Services
IXHL,Incannex Healthcare Inc. Common Stock,$0.70,-0.021,-2.913%,12501796.00,Australia,,33744,Health Care,Biotechnology: Pharmaceutical Preparations
IZEA,IZEA Worldwide Inc. Common Stock,$2.075,0.015,0.728%,35205921.00,United States,,54815,Consumer Discretionary,Advertising
IZM,ICZOOM Group Inc. Class A Ordinary Shares,$1.80,0.01,0.559%,21117591.00,China,2023,46125,Consumer Discretionary,Consumer Electronics/Video Chains
J,Jacobs Solutions Inc. Common Stock,$123.44,-0.53,-0.428%,15126790872.00,United States,2022,819936,Industrials,Military/Government/Technical
JACK,Jack In The Box Inc. Common Stock,$28.63,0.27,0.952%,539913014.00,United States,,556413,Consumer Discretionary,Restaurants
JACS,Jackson Acquisition Company II Class A Ordinary Shares,$10.07,0.00,0.00%,0.00,,2025,26205,,
JAGX,Jaguar Health Inc. Common Stock,$5.38,0.25,4.873%,3529748.00,United States,2015,36689,Health Care,Biotechnology: Pharmaceutical Preparations
JAKK,JAKKS Pacific Inc. Common Stock,$25.48,-0.04,-0.157%,284005940.00,United States,1996,50929,Consumer Discretionary,Recreational Games/Products/Toys
JAMF,Jamf Holding Corp. Common Stock,$12.99,0.04,0.309%,1680783725.00,United States,2020,526527,Technology,Computer Software: Prepackaged Software
JANX,Janux Therapeutics Inc. Common Stock,$29.78,-0.34,-1.129%,1760151278.00,United States,2021,865567,Health Care,Biotechnology: Pharmaceutical Preparations
JAZZ,Jazz Pharmaceuticals plc Common Stock (Ireland),$126.40,-4.48,-3.423%,7676585346.00,Ireland,2007,1607966,Health Care,Biotechnology: Pharmaceutical Preparations
JBDI,JBDI Holdings Limited Ordinary Shares,$0.80,0.02,2.564%,15830000.00,Singapore,2024,87143,,
JBGS,JBG SMITH Properties Common Shares ,$15.96,0.14,0.885%,1315966478.00,United States,2017,714192,Real Estate,Real Estate Investment Trusts
JBHT,J.B. Hunt Transport Services Inc. Common Stock,$150.80,-0.59,-0.39%,15081237917.00,United States,,1043218,Industrials,Trucking Freight/Courier Services
JBI,Janus International Group Inc. Common Stock,$7.50,-0.25,-3.226%,1052330498.00,United States,2021,1327754,Industrials,Building Products
JBL,Jabil Inc. Common Stock,$139.40,-4.46,-3.10%,15219486385.00,United States,1993,1434252,Technology,Electrical Products
JBLU,JetBlue Airways Corporation Common Stock,$5.33,-0.09,-1.661%,1881495581.00,United States,2002,18748504,Consumer Discretionary,Air Freight/Delivery Services
JBSS,John B. Sanfilippo & Son Inc. Common Stock,$71.03,1.33,1.908%,826651899.00,United States,1991,56288,Consumer Staples,Specialty Foods
JBTM,JBT Marel Corporation Common Stock,$125.89,-0.88,-0.694%,6531210212.00,United States,,364437,Industrials,Industrial Machinery/Components
JCE,Nuveen Core Equity Alpha Fund Common Shares of Beneficial Interest,$14.69,0.07,0.479%,0.00,United States,2007,11800,Finance,Trusts Except Educational Religious and Charitable
JCI,Johnson Controls International plc Ordinary Share,$82.17,-0.59,-0.713%,54281022209.00,Switzerland,,4444728,Industrials,Industrial Machinery/Components
JCSE,JE Cleantech Holdings Limited Ordinary Shares,$1.0645,-0.0255,-2.339%,5329596.00,Singapore,2022,404,Consumer Discretionary,Miscellaneous manufacturing industries
JCTC,Jewett-Cameron Trading Company Common Shares,$4.50,0.00,0.00%,15831536.00,United States,,2950,Consumer Discretionary,RETAIL: Building Materials
JD,JD.com Inc. American Depositary Shares,$42.89,1.11,2.657%,67428144623.00,China,2014,9563568,Consumer Discretionary,Other Specialty Stores
JDZG,JIADE LIMITED Common stock,$0.6054,-0.0446,-6.862%,14672154.00,China,2024,82213,Real Estate,Other Consumer Services
JEF,Jefferies Financial Group Inc. Common Stock,$54.35,-5.94,-9.852%,11201246891.00,United States,,5406518,Finance,Investment Bankers/Brokers/Service
JELD,JELD-WEN Holding Inc. Common Stock,$6.27,0.16,2.619%,532009337.00,United States,2017,810811,Basic Materials,Forest Products
JEQ,abrdn Japan Equity Fund Inc. Common Stock,$6.70,0.01,0.149%,91119933.00,United States,1992,44807,Consumer Discretionary,Air Freight/Delivery Services
JFB,JFB Construction Holdings Class A Common Stock,$4.08,-0.07,-1.687%,37740000.00,United States,2025,8542,,
JFBR,Jeffs' Brands Ltd Ordinary Shares,$1.17,-0.12,-9.302%,841659.00,Israel,2022,77652,Consumer Discretionary,Other Specialty Stores
JFBRW,Jeffs' Brands Ltd Warrant,$0.0244,-0.0001,-0.408%,17553.00,Israel,2022,61,Consumer Discretionary,Other Specialty Stores
JFIN,Jiayin Group Inc. American Depositary Shares,$14.84,2.74,22.645%,787002092.00,China,2019,783327,Finance,Finance: Consumer Services
JFR,Nuveen Floating Rate Income Fund Common Stock,$8.43,-0.01,-0.118%,0.00,United States,2004,631567,Finance,Trusts Except Educational Religious and Charitable
JFU,9F Inc. American Depositary Shares,$1.50,0.05,3.448%,17660000.00,China,2019,3414,Finance,Finance: Consumer Services
JG,Aurora Mobile Limited American Depositary Shares,$10.46,0.07,0.674%,62556135.00,China,2018,71309,Technology,Computer Software: Programming Data Processing
JGH,Nuveen Global High Income Fund Common Shares of Beneficial Interest,$12.955,-0.065,-0.499%,0.00,United States,2014,42207,Finance,Investment Managers
JHG,Janus Henderson Group plc Ordinary Shares,$37.07,-0.43,-1.147%,5840668091.00,United Kingdom,2017,1591739,Finance,Investment Managers
JHI,John Hancock Investors Trust Common Stock,$13.59,-0.05,-0.367%,118838394.00,United States,,6160,Finance,Trusts Except Educational Religious and Charitable
JHS,John Hancock Income Securities Trust Common Stock,$11.25,0.00,0.00%,131024081.00,United States,,2744,Finance,Finance Companies
JHX,James Hardie Industries plc American Depositary Shares (Ireland),$24.64,0.79,3.312%,10688453382.00,Ireland,,9799585,Industrials,Building Materials
JILL,J. Jill Inc. Common Stock,$19.49,0.12,0.62%,298983967.00,United States,2017,176779,Consumer Discretionary,Apparel
JJSF,J & J Snack Foods Corp. Common Stock,$130.68,3.03,2.374%,2546986393.00,United States,1986,124782,Consumer Staples,Specialty Foods
JKHY,Jack Henry & Associates Inc. Common Stock,$179.32,-0.07,-0.039%,13072010364.00,United States,1985,373218,Technology,EDP Services
JKS,JinkoSolar Holding Company Limited American Depositary Shares (each representing 4 Common Shares),$20.10,-0.43,-2.094%,1105513125.00,China,2010,809879,Technology,Semiconductors
JL,J-Long Group Limited Ordinary Shares,$4.2817,-0.0483,-1.115%,13444538.00,Hong Kong,2024,34975,Consumer Discretionary,Clothing/Shoe/Accessory Stores
JLL,Jones Lang LaSalle Incorporated Common Stock,$250.51,-3.92,-1.541%,11872122824.00,United States,,236075,Finance,Real Estate
JLS,Nuveen Mortgage and Income Fund,$18.74,-0.04,-0.213%,0.00,United States,2009,6457,Finance,Investment Managers
JMIA,Jumia Technologies AG American Depositary Shares each representing two Ordinary Shares,$2.34,-0.02,-0.847%,286563011.00,,2019,1362309,Consumer Discretionary,Catalog/Specialty Distribution
JMM,Nuveen Multi-Market Income Fund (MA),$6.45,0.2706,4.379%,0.00,United States,,20659,Finance,Trusts Except Educational Religious and Charitable
JMSB,John Marshall Bancorp Inc. Common Stock,$17.28,0.12,0.699%,246070881.00,United States,,5477,Finance,Major Banks
JNJ,Johnson & Johnson Common Stock,$163.13,1.41,0.872%,392754511129.00,United States,,6752466,Health Care,Biotechnology: Pharmaceutical Preparations
JNPR,Juniper Networks Inc. Common Stock,$36.15,0.03,0.083%,12044809932.00,United States,1999,2068094,Telecommunications,Computer Communications Equipment
JNVR,Janover Inc. Common Stock,$4.59,-0.1999,-4.173%,6483136.00,United States,2023,2645,Finance,Finance: Consumer Services
JOB,GEE Group Inc. Common Stock,$0.20,-0.007,-3.382%,21882649.00,United States,1968,459181,Consumer Discretionary,Diversified Commercial Services
JOBY,Joby Aviation Inc. Common Stock,$6.43,-0.14,-2.131%,5065662828.00,United States,2020,7400628,Industrials,Aerospace
JOE,St. Joe Company (The) Common Stock,$46.93,-0.23,-0.488%,2737263631.00,United States,,190869,Real Estate,Homebuilding
JOF,Japan Smaller Capitalization Fund Inc Common Stock,$8.48,0.02,0.236%,0.00,United States,1990,81026,Finance,Trusts Except Educational Religious and Charitable
JOUT,Johnson Outdoors Inc. Class A Common Stock,$25.83,0.32,1.254%,266914925.00,United States,,23307,Consumer Discretionary,Recreational Games/Products/Toys
JPC,Nuveen Preferred & Income Opportunities Fund,$7.89,-0.03,-0.379%,0.00,United States,2003,814053,Finance,Investment Managers
JPI,Nuveen Preferred Securities & Income Opportunities Fund Common Shares,$19.66,0.005,0.025%,447705758.00,,2012,19966,Finance,Finance Companies
JPM,JP Morgan Chase & Co. Common Stock,$248.12,-2.91,-1.159%,693769845284.00,United States,,8022517,Finance,Major Banks
JPM^C,J P Morgan Chase & Co Depositary Shares each representing a 1/400th interest in a share of 6.00% Non-Cumulative  Preferred Stock Series EE,$25.19,-0.06,-0.238%,,United States,,93663,,
JPM^D,J P Morgan Chase & Co Depositary Shares each representing a 1/400th  interest in a share of 5.75% Non-Cumulative  Preferred Stock Series DD,$24.88,-0.04,-0.161%,,United States,,82574,,
JPM^J,J P Morgan Chase & Co Depositary Shares each representing a 1/400th interest in a share of JPMorgan Chase & Co. 4.75% Non-Cumulative Preferred Stock Series GG,$20.77,-0.07,-0.336%,,United States,,62908,,
JPM^K,J P Morgan Chase & Co Depositary Shares each representing a 1/400th interest in a share of 4.55% Non-Cumulative Preferred Stock Series JJ,$19.93,-0.02,-0.10%,,United States,,80227,,
JPM^L,J P Morgan Chase & Co Depositary Shares each representing a 1/400th interest in a share of 4.625% Non-Cumulative Preferred Stock Series LL,$20.26,-0.01,-0.049%,,United States,,129684,,
JPM^M,J P Morgan Chase & Co Depositary Shares each representing a 1/400th interest in a share of 4.20% Non-Cumulative Preferred Stock Series MM,$18.70,0.05,0.268%,,United States,,134957,,
JQC,Nuveen Credit Strategies Income Fund Shares of Beneficial Interest,$5.35,-0.02,-0.372%,0.00,United States,2003,1683730,Finance,Finance Companies
JRI,Nuveen Real Asset Income and Growth Fund Common Shares of Beneficial Interest,$13.00,0.04,0.309%,0.00,United States,2012,57569,Finance,Finance Companies
JRS,Nuveen Real Estate Income Fund Common Shares of Beneficial Interest,$8.12,0.00,0.00%,0.00,United States,2001,43059,Finance,Finance/Investors Services
JRSH,Jerash Holdings (US) Inc. Common Stock,$3.49,0.04,1.159%,42908992.00,United States,2018,10719,Consumer Discretionary,Apparel
JRVR,James River Group Holdings Ltd. Common Shares,$4.36,0.18,4.306%,199009226.00,Bermuda,2014,148841,Finance,Property-Casualty Insurers
JSM,Navient Corporation 6% Senior Notes due December 15 2043,$19.10,0.074,0.389%,1953477387.00,United States,,19699,Finance,Investment Bankers/Brokers/Service
JSPR,Jasper Therapeutics Inc. Common Stock,$4.84,0.16,3.419%,72707070.00,United States,2020,227651,Health Care,Biotechnology: Biological Products (No Diagnostic Substances)
JTAI,Jet.AI Inc. Common Stock,$4.49,-0.05,-1.101%,9819634.00,United States,2021,100082,Consumer Discretionary,Transportation Services
JUNE,Junee Limited Ordinary Shares,$8.8056,-0.4844,-5.214%,114537556.00,Hong Kong,2024,113992,,
JUNS,Jupiter Neurosciences Inc. Common Stock,$0.7428,-0.0062,-0.828%,24589547.00,United States,2024,84317,Health Care,Biotechnology: Pharmaceutical Preparations
JVA,Coffee Holding Co. Inc. Common Stock,$3.48,-0.08,-2.247%,19865925.00,United States,2005,149627,Consumer Staples,Packaged Foods
JWEL,Jowell Global Ltd. Ordinary Shares,$2.28,0.0937,4.286%,4948683.00,China,2021,1468,Consumer Discretionary,Other Consumer Services
JWN,Nordstrom Inc. Common Stock,$24.45,0.02,0.082%,4080667592.00,United States,,1574865,Consumer Discretionary,Clothing/Shoe/Accessory Stores
JXG,JX Luxventure Group Inc. Common Stock,$2.48,0.18,7.826%,3759179.00,China,2013,11926,Consumer Staples,Apparel
JXN,Jackson Financial Inc. Class A Common Stock ,$85.74,-1.91,-2.179%,6228692647.00,United States,2021,786735,Finance,Life Insurance
JXN^A,Jackson Financial Inc. Depositary Shares each representing a 1/1000th interest in a share of Fixed-Rate Reset Noncumulative Perpetual Preferred Stock Series A,$25.99,0.09,0.347%,,United States,,26416,,
JYD,Jayud Global Logistics Limited Class A Ordinary Shares,$6.90,0.72,11.65%,147330339.00,China,2023,13947886,Consumer Discretionary,Oil Refining/Marketing
JYNT,The Joint Corp. Common Stock,$12.75,0.02,0.157%,193480370.00,United States,2014,32249,Miscellaneous,Multi-Sector Companies
JZ,Jianzhi Education Technology Group Company Limited American Depositary Shs,$0.92,0.0745,8.811%,18570200.00,China,2022,11406,Real Estate,Other Consumer Services
JZXN,Jiuzi Holdings Inc. Ordinary Shares,$4.87,-0.08,-1.616%,53625464.00,China,2021,34020,Consumer Discretionary,Retail-Auto Dealers and Gas Stations
K,Kellanova Common Stock,$82.45,0.00,0.00%,28463052851.00,United States,,1003705,Consumer Staples,Packaged Foods
KAI,Kadant Inc Common Stock,$351.20,5.68,1.644%,4128319826.00,United States,1992,228141,Industrials,Industrial Machinery/Components
KALA,KALA BIO Inc. Common Stock,$6.32,-0.25,-3.805%,29136078.00,United States,2017,29340,Health Care,Biotechnology: Pharmaceutical Preparations
KALU,Kaiser Aluminum Corporation Common Stock,$64.91,-0.47,-0.719%,1045081702.00,United States,,131158,Industrials,Metal Fabrications
KALV,KalVista Pharmaceuticals Inc. Common Stock,$12.34,0.27,2.237%,613490948.00,United Kingdom,2015,466185,Health Care,Biotechnology: Pharmaceutical Preparations
KAPA,Kairos Pharma Ltd. Common Stock,$0.97,0.01,1.042%,12461381.00,,2024,56386,Health Care,Biotechnology: Pharmaceutical Preparations
KAR,OPENLANE Inc. Common Stock,$19.34,-1.65,-7.861%,2067654427.00,United States,2009,2295369,Consumer Discretionary,Retail-Auto Dealers and Gas Stations
KARO,Karooooo Ltd. Ordinary Shares,$43.04,-0.66,-1.51%,1329936000.00,Singapore,2021,31699,Technology,Computer Software: Prepackaged Software
KAVL,Kaival Brands Innovations Group Inc. Common Stock,$0.5699,-0.0051,-0.887%,6577958.00,United States,,85547,Consumer Discretionary,Other Consumer Services
KB,KB Financial Group Inc,$55.13,-0.81,-1.448%,20875736672.00,South Korea,,170784,Finance,Commercial Banks
KBDC,Kayne Anderson BDC Inc. Common Stock,$16.71,-0.01,-0.06%,1187407403.00,,2024,104152,,
KBH,KB Home Common Stock,$59.21,0.10,0.169%,4272405371.00,United States,1986,1038436,Consumer Discretionary,Homebuilding
KBR,KBR Inc. Common Stock,$51.18,0.20,0.392%,6778364824.00,United States,2006,837625,Industrials,Military/Government/Technical
KBSX,FST Corp. Ordinary Shares,$2.40,-0.18,-6.977%,17260495.00,Taiwan,,191171,Consumer Discretionary,Recreational Games/Products/Toys
KC,Kingsoft Cloud Holdings Limited American Depositary Shares,$15.21,-0.32,-2.061%,3858558782.00,China,2020,4438932,Technology,Computer Software: Prepackaged Software
KD,Kyndryl Holdings Inc. Common Stock,$32.32,-1.74,-5.109%,7520686337.00,United States,2021,12305388,Technology,EDP Services
KDLY,Kindly MD Inc. Common Stock,$2.08,0.37,21.637%,12433150.00,United States,2024,574677,Health Care,Medical/Nursing Services
KDLYW,Kindly MD Inc. Warrants,$0.354,0.0181,5.389%,2116027.00,United States,2024,3487,Health Care,Medical/Nursing Services
KDP,Keurig Dr Pepper Inc. Common Stock,$34.26,0.20,0.587%,46482285046.00,United States,,13064533,Consumer Staples,Beverages (Production/Distribution)
KE,Kimball Electronics Inc. Common Stock,$16.86,-0.31,-1.805%,413991618.00,United States,,102343,Technology,Electrical Products
KELYA,Kelly Services Inc. Class A Common Stock,$13.59,0.20,1.494%,474128545.00,United States,,201414,Consumer Discretionary,Professional Services
KELYB,Kelly Services Inc. Class B Common Stock,$13.54,0.00,0.00%,472384143.00,United States,,26,Consumer Discretionary,Professional Services
KEN,Kenon Holdings Ltd. Ordinary Shares,$32.14,0.83,2.651%,1695894258.00,Singapore,2015,11903,Utilities,Electric Utilities: Central
KEP,Korea Electric Power Corporation Common Stock,$7.61,-0.03,-0.393%,9770693252.00,South Korea,1994,55412,Utilities,Electric Utilities: Central
KEQU,Kewaunee Scientific Corporation Common Stock,$42.50,2.50,6.25%,121314720.00,United States,,27501,Industrials,Medical Specialities
KEX,Kirby Corporation Common Stock,$102.89,-0.54,-0.522%,5877694140.00,United States,,383134,Consumer Discretionary,Marine Transportation
KEY,KeyCorp Common Stock,$16.17,-0.23,-1.402%,17869779372.00,United States,,13081251,Finance,Major Banks
KEY^I,KeyCorp Depositary Shares Each Representing a 1/40th Ownership Interest in a Share of Fixed-to-Floating Rate Perpetual Non-Cumulative Preferred Stock Series E,$24.46,-0.32,-1.291%,,United States,,36456,,
KEY^J,KeyCorp Depositary Shares each representing a 1/40th ownership interest in a share of Fixed Rate Perpetual Non-Cumulative Preferred Stock Series F,$21.72,-0.16,-0.731%,,United States,,40644,,
KEY^K,KeyCorp Depositary Shares each representing a 1/40th ownership interest in a share of Fixed Rate Perpetual Non-Cumulative Preferred Stock Series G,$21.58,-0.20,-0.918%,,United States,,21124,,
KEY^L,KeyCorp Depositary Shares each representing a 1/40th ownership interest in a share of Fixed Rate Perpetual Non-Cumulative Preferred Stock Series H,$24.29,-0.25,-1.019%,,United States,,46033,,
KEYS,Keysight Technologies Inc. Common Stock,$155.15,-1.25,-0.799%,26811551247.00,United States,2014,742493,Industrials,Industrial Machinery/Components
KF,Korea Fund Inc. (The) New Common Stock,$20.8901,-0.1199,-0.571%,0.00,United States,,7925,Finance,Investment Managers
KFFB,Kentucky First Federal Bancorp Common Stock,$2.8948,-0.1052,-3.507%,23409423.00,United States,2005,281,Finance,Savings Institutions
KFII,K&F Growth Acquisition Corp. II Class A Ordinary shares,$9.96,0.01,0.101%,0.00,United States,2025,110072,,
KFIIR,K&F Growth Acquisition Corp. II Rights,$0.12,0.00,0.00%,0.00,United States,2025,31200,,
KFIIU,K&F Growth Acquisition Corp. II Unit,$10.07,0.00,0.00%,0.00,United States,2025,5,Finance,Blank Checks
KFRC,Kforce Inc. Common Stock,$49.52,0.65,1.33%,946376720.00,United States,1995,125119,Consumer Discretionary,Professional Services
KFS,Kingsway Financial Services Inc. Common Stock (DE),$8.00,0.04,0.503%,220297208.00,Canada,,42190,Finance,Property-Casualty Insurers
KFY,Korn Ferry Common Stock,$68.70,0.26,0.38%,3548071887.00,United States,1999,415813,Consumer Discretionary,Diversified Commercial Services
KGC,Kinross Gold Corporation Common Stock,$12.51,0.31,2.541%,15374790000.00,Canada,2001,15508969,Basic Materials,Precious Metals
KGEI,Kolibri Global Energy Inc. Common stock,$8.16,0.29,3.685%,291605474.00,United States,,176903,Energy,Oil & Gas Production
KGS,Kodiak Gas Services Inc. Common Stock,$37.50,-0.40,-1.055%,3297551100.00,United States,2023,542976,Utilities,Natural Gas Distribution
KHC,The Kraft Heinz Company Common Stock,$30.07,0.38,1.28%,35933347887.00,United States,,8164209,Consumer Staples,Packaged Foods
KIDS,OrthoPediatrics Corp. Common Stock,$24.75,0.34,1.393%,601093103.00,United States,2017,110536,Health Care,Medical/Dental Instruments
KIM,Kimco Realty Corporation (HC) Common Stock,$21.01,-0.20,-0.943%,14275917534.00,United States,,5928203,Real Estate,Real Estate Investment Trusts
KIM^L,Kimco Realty Corporation Class L Depositary Shares each of which represents a one-one thousandth fractional interest in a share of 5.125% Class L Cumulative Redeemable Preferred Stock liquidation preference $25000.00 per share,$21.06,-0.055,-0.26%,,United States,,18134,,
KIM^M,Kimco Realty Corporation Class M Depositary Shares each of which represents a one-one thousandth fractional interest in a share of 5.25% Class M Cumulative Redeemable Preferred Stock liquidation preference $25000.00 per share,$21.30,-0.0532,-0.249%,,United States,,9875,,
KIM^N,Kimco Realty Corporation Depositary Shares each representing 1/1000th interest in a share of 7.25% Class N Cumulative Convertible Perpetual Preferred Stock,$59.83,0.00,0.00%,,United States,,204,,
KIND,Nextdoor Holdings Inc. Class A Common Stock,$1.63,-0.02,-1.212%,629671665.00,United States,,1546162,Technology,Computer Software: Programming Data Processing
KINS,Kingstone Companies Inc. Common Stock,$17.59,0.92,5.519%,241524807.00,United States,,338859,Finance,Property-Casualty Insurers
KIO,KKR Income Opportunities Fund Common Shares,$12.33,0.00,0.00%,0.00,United States,2013,164223,Finance,Investment Managers
KIRK,Kirkland's Inc. COMMONSTOCK,$1.37,0.04,3.008%,17971581.00,United States,2002,57868,Consumer Discretionary,Other Specialty Stores
KITT,Nauticus Robotics Inc. Common stock,$0.99,-0.07,-6.604%,6343400.00,United States,2021,1628920,Industrials,Industrial Machinery/Components
KITTW,Nauticus Robotics Inc. Warrant,$0.0639,-0.0072,-10.127%,409438.00,United States,2021,8053,Industrials,Industrial Machinery/Components
KKR,KKR & Co. Inc. Common Stock,$117.54,-1.90,-1.591%,104404967649.00,United States,,4323617,Finance,Investment Managers
KKR^D,KKR & Co. Inc. 6.25% Series D Mandatory Convertible Preferred Stock,$49.55,-0.60,-1.196%,,United States,,844356,,
KKRS,KKR Group Finance Co. IX LLC 4.625% Subordinated Notes due 2061,$18.22,0.08,0.441%,16183924711.00,United States,2021,57686,,
KLAC,KLA Corporation Common Stock,$700.00,-5.54,-0.785%,93020722200.00,United States,1980,735127,Technology,Electronic Components
KLC,KinderCare Learning Companies Inc. Common Stock,$12.72,-0.18,-1.395%,1501039831.00,,2024,878347,Consumer Discretionary,Other Consumer Services
KLG,WK Kellogg Co Common Stock,$19.63,0.58,3.045%,1692046305.00,United States,2023,570512,Consumer Staples,Packaged Foods
KLIC,Kulicke and Soffa Industries Inc. Common Stock,$34.50,-0.97,-2.735%,1841719296.00,Singapore,,648557,Technology,Semiconductors
KLRS,Kalaris Therapeutics Inc. Common Stock,$9.01,-0.20,-2.172%,168508741.00,United States,2020,18903,Health Care,Biotechnology: Biological Products (No Diagnostic Substances)
KLTO,Klotho Neurosciences Inc. Common Stock,$0.262,0.0067,2.624%,5571041.00,United States,2022,248485,Health Care,Biotechnology: Biological Products (No Diagnostic Substances)
KLTOW,Klotho Neurosciences Inc. Warrant,$0.0243,0.0024,10.959%,516703.00,United States,2022,30688,Health Care,Biotechnology: Biological Products (No Diagnostic Substances)
KLTR,Kaltura Inc. Common Stock,$1.92,-0.08,-4.00%,295945475.00,United States,2021,373606,Technology,Computer Software: Prepackaged Software
KLXE,KLX Energy Services Holdings Inc. Common Stock,$3.55,-0.09,-2.473%,61781960.00,United States,,132572,Energy,Oilfield Services/Equipment
KMB,Kimberly-Clark Corporation Common Stock,$140.56,0.95,0.68%,46621587517.00,United States,,1052655,Consumer Discretionary,Containers/Packaging
KMDA,Kamada Ltd. Ordinary Shares,$6.83,-0.07,-1.014%,392759362.00,Israel,2013,39979,Health Care,Biotechnology: Pharmaceutical Preparations
KMI,Kinder Morgan Inc. Common Stock,$28.23,-0.25,-0.878%,62726016196.00,United States,2011,8885233,Utilities,Natural Gas Distribution
KMPB,Kemper Corporation 5.875% Fixed-Rate Reset Junior Subordinated Debentures due 2062,$22.97,-0.07,-0.304%,1467795794.00,United States,2022,31806,Finance,Property-Casualty Insurers
KMPR,Kemper Corporation,$68.80,1.09,1.61%,4396358322.00,United States,,531653,Finance,Property-Casualty Insurers
KMT,Kennametal Inc. Common Stock,$21.98,-0.08,-0.363%,1700379987.00,United States,,744499,Industrials,Industrial Machinery/Components
KMTS,Kestra Medical Technologies Ltd. Common Stock,$24.02,0.26,1.094%,1144588237.00,United States,2025,183991,Health Care,Medical/Dental Instruments
KMX,CarMax Inc,$76.93,1.86,2.478%,11831832000.00,United States,,4564340,Consumer Discretionary,Retail-Auto Dealers and Gas Stations
KN,Knowles Corporation Common Stock,$15.94,-0.11,-0.685%,1397350978.00,United States,2014,540365,Consumer Staples,Consumer Electronics/Appliances
